"conversation_id_str","created_at","favorite_count","full_text","id_str","image_url","in_reply_to_screen_name","lang","location","quote_count","reply_count","retweet_count","tweet_url","user_id_str","username"
"2016828680203620836","2026-01-29T11:00:02.000Z","706","Puluhan siswa SMA Negeri 2 Kudus mengalami diare dan pusing yang diduga akibat keracunan sajian program Makan Bergizi Gratis (MBG).

&gt;&gt; https://t.co/6YlZalexjr https://t.co/0vWXaDC34o","2016828680203620836","https://pbs.twimg.com/amplify_video_thumb/2016816295959023618/img/d1docT1N9EYqQiSr.jpg","","in","","46","62","412","https://x.com/detikcom/status/2016828680203620836","69183155","detikcom"
"2018504997764517932","2026-02-03T02:01:08.000Z","0","Presiden Prabowo Subianto menceritakan tentang para ahli dari Amerika Serikat yang datang kepadanya untuk meneliti program Makan Bergizi Gratis (MBG). https://t.co/amPu4pGTJK","2018504997764517932","https://pbs.twimg.com/media/HAMrlunbgAAQJJV.jpg","","in","","0","0","0","https://x.com/rkriemas2045/status/2018504997764517932","1531971112929615872","rkriemas2045"
"2014693338268762357","2026-01-23T13:34:59.000Z","31","“Kalau ini dilompati atas nama program makan bergizi gratis, saya kira ini tidak adil,” ujarnya. Ia mengingatkan, kondisi tersebut justru berisiko mempergelap masa depan pendidikan.

Tonton selengkapnya di film dokumenter “Tak Ada Makan Siang Gratis”
https://t.co/VukCtrNrMB","2014693344950272373","","watchdoc_ID","in","","1","4","13","https://x.com/watchdoc_ID/status/2014693344950272373","2959310304","watchdoc_ID"
"2018497751282061644","2026-02-03T01:32:20.000Z","0","Moratorium dan Perombakan Total Program Makan Bergizi Gratis (MBG) - Tandatangani Petisi! https://t.co/34hahAbRU7 via @ChangeOrg_ID","2018497751282061644","","","in","","0","0","0","https://x.com/sukanyamotor2/status/2018497751282061644","1052054379770011649","sukanyamotor2"
"2017009933531959557","2026-01-29T23:00:17.000Z","18","Gausah marah2 sm sendernya. Ini semua salah your govt yg pangkas dana pendidikan demi makan (tdk) bergizi gratis. Pinter kaga, kenyang kaga, bego dan keracunan iya.","2017009933531959557","","","in","","1","1","2","https://x.com/lovemyself07_/status/2017009933531959557","1162991688064782336","lovemyself07_"
